{
  "$schema": "http://json-schema.org/draft-07/schema#",
  "$id": "https://kingin-yellows.dev/schemas/catalog.schema.json",
  "title": "Neutral Catalog Root Schema",
  "description": "Schema for catalog/catalog.json — the marketplace identity, canonical plugin order, and per-target presentation defaults that scripts/generate-manifests.js reads to emit the Claude and Codex distribution artifacts.",
  "$comment": "Repo-derived schema, not an official Anthropic or OpenAI schema. The 'targets.codex' shape here (displayName, category, policy) is derived from the July 2026 Codex plugin contract recorded in docs/research/2026-07-16-codex-plugin-contract-spike.md and is expected to evolve as that contract stabilizes upstream.",
  "type": "object",
  "additionalProperties": false,
  "required": ["name", "description", "owner", "metadata", "pluginOrder", "targets"],
  "properties": {
    "name": {
      "type": "string",
      "minLength": 1,
      "description": "Marketplace identifier, spliced verbatim into the generated .claude-plugin/marketplace.json."
    },
    "description": {
      "type": "string",
      "minLength": 1
    },
    "owner": {
      "type": "object",
      "additionalProperties": false,
      "required": ["name"],
      "properties": {
        "name": { "type": "string", "minLength": 1 },
        "url": { "type": "string", "format": "uri" },
        "email": { "type": "string", "format": "email" }
      }
    },
    "metadata": {
      "type": "object",
      "additionalProperties": false,
      "properties": {
        "description": { "type": "string" },
        "version": {
          "type": "string",
          "pattern": "^[0-9]+\\.[0-9]+\\.[0-9]+$",
          "description": "The root catalog track version — distinct from any individual plugin's package.json version."
        }
      }
    },
    "pluginOrder": {
      "type": "array",
      "minItems": 1,
      "uniqueItems": true,
      "items": {
        "type": "string",
        "pattern": "^[a-zA-Z0-9_-]+$"
      },
      "description": "Canonical 17-plugin order. Both the Claude and Codex emitters filter this order by target enablement rather than storing a separate order per target."
    },
    "targets": {
      "type": "object",
      "additionalProperties": false,
      "required": ["claude", "codex"],
      "properties": {
        "claude": {
          "type": "object",
          "additionalProperties": false,
          "required": ["marketplaceSchema"],
          "properties": {
            "marketplaceSchema": {
              "type": "string",
              "format": "uri",
              "description": "$schema value spliced into the generated .claude-plugin/marketplace.json."
            }
          }
        },
        "codex": {
          "type": "object",
          "additionalProperties": false,
          "required": ["displayName", "category", "policy"],
          "properties": {
            "displayName": { "type": "string", "minLength": 1 },
            "category": { "type": "string", "minLength": 1 },
            "policy": {
              "type": "object",
              "additionalProperties": false,
              "required": ["installation", "authentication"],
              "properties": {
                "installation": { "type": "string", "enum": ["AVAILABLE"] },
                "authentication": { "type": "string", "enum": ["ON_INSTALL"] }
              },
              "description": "Enum values are deliberately narrow to the single policy this pilot exercises (R5); widen when a second policy value is actually needed."
            }
          },
          "description": "Marketplace-wide Codex presentation defaults, required unconditionally: buildCodexMarketplace (scripts/lib/generate/emit-codex.js) dereferences displayName/category/policy even when the Codex plugin list is empty (the committed empty-state artifact still needs a root displayName)."
        },
        "cursor": {
          "type": "object",
          "additionalProperties": false,
          "required": ["name"],
          "properties": {
            "name": { "type": "string", "minLength": 1 },
            "description": { "type": "string", "minLength": 1 },
            "owner": {
              "type": "object",
              "additionalProperties": false,
              "required": ["name"],
              "properties": {
                "name": { "type": "string", "minLength": 1 },
                "email": { "type": "string", "format": "email" }
              }
            }
          },
          "description": "Marketplace-wide Cursor presentation defaults — OPTIONAL, unlike targets.codex above: the upstream Cursor marketplace shape (schemas/cursor-marketplace.schema.json: {name, owner?, metadata?, plugins[]}) has no displayName/category/policy equivalent, and buildCursorMarketplace (scripts/lib/generate/emit-cursor.js) emits NO artifact at all — not even an empty-state one — when this block is absent or when zero plugins are Cursor-enabled; the stale-artifact sweep removes any leftover .cursor-plugin/marketplace.json in both cases."
        }
      }
    }
  }
}
